{
  "artifact_sha256": "3333333333333333333333333333333333333333333333333333333333333333",
  "build_commit": "0000000000000000000000000000000000000000",
  "config_bundle_sha256": "2222222222222222222222222222222222222222222222222222222222222222",
  "contract_manifest_sha256": "1111111111111111111111111111111111111111111111111111111111111111",
  "emitted_at_us": 1786156800123456,
  "event_id": "evt_triad_quarantine_record_v1",
  "event_kind": "QUARANTINE",
  "payload": {
    "boundary": "x",
    "contract_id": "x",
    "observed_at_us": 1786156800123456,
    "quarantine_id": "x",
    "raw_reference": "x",
    "rejection_reason": "x",
    "source": "x"
  },
  "producer_epoch": "42",
  "producer_instance_id": "inst_golden_01",
  "producer_service": "contract-boundary",
  "schema": "triad.quarantine_record.v1",
  "schema_version": "1.0.0"
}
